{
 "date": "2026-10-28",
 "generated_at": "2026-10-28T07:37:44+13:00",
 "timezone": "Pacific/Auckland",
 "sections": {
  "kr_society": {
   "label": "사회",
   "briefing": "사회 분야에서는 김건희 여사의 구속 연장과 구룡마을 대형 화재, 의료 및 마약 치료 인프라 문제 등이 집중 보도되었습니다.",
   "items": [
    {
     "id": "773d3615cd5e",
     "title_ko": "대법원, 김건희 여사 추가 구속영장 발부…구속 2개월 연장",
     "summary_ko": [
      "대법원이 오는 31일 구속 만료를 앞둔 김건희 여사에 대해 추가 구속영장을 발부했습니다.",
      "특검팀이 매관매직 사건을 근거로 구속 필요성 의견서를 제출함에 따라 비공개 심문을 거쳐 이루어졌습니다.",
      "이번 결정으로 구속 상태가 2개월 연장되었으며 최대 8개월까지 늘어날 수 있습니다."
     ],
     "tags": [
      "정치",
      "사회"
     ],
     "importance": 9,
     "sources": [
      {
       "name": "매일경제",
       "url": "https://www.mk.co.kr/news/society/12187596"
      },
      {
       "name": "조선일보",
       "url": "https://www.chosun.com/national/court_law/2026/10/28/3Y6PXFLPXVDMVDSDHJDQVK4H4A/"
      }
     ],
     "original_title": "김건희 구속 2개월 연장… 대법, 구속영장 추가 발부",
     "published_at": "2026-10-27T15:46+00:00",
     "qa": [
      {
       "q": "김건희 여사의 구속은 얼마나 연장되나요?",
       "a": "대법원의 추가 구속영장 발부로 구속 상태가 일단 2개월 늘어나며, 최대 8개월까지 연장이 가능해요."
      },
      {
       "q": "추가 영장이 발부된 근거는 무엇인가요?",
       "a": "특검팀이 별도로 상고심이 진행 중인 매관매직 사건을 근거로 구속 필요성 의견서를 제출한 데 따른 조치예요."
      },
      {
       "q": "김 여사 측은 어떤 입장을 보이고 있나요?",
       "a": "별도 사건을 통한 구속 연장이 형사소송법의 구속기간 제한 취지에 어긋나며 무죄 추정의 원칙을 훼손할 수 있다고 반발하고 있어요."
      }
     ]
    },
    {
     "id": "e6c7765bece7",
     "title_ko": "강남 구룡마을 대형 화재 발생…강풍 타고 확산하며 진화 난항",
     "summary_ko": [
      "서울 강남구 구룡마을 2지구 가건물에서 시작된 불이 강한 바람을 타고 인근 지구로 빠르게 확산했습니다.",
      "소방 당국이 대응 2단계를 발령하고 총력 대응에 나섰으나 판자촌 구조와 용수 부족으로 진화에 어려움을 겪었습니다.",
      "이번 화재로 77가구 107명이 피해를 보았으며 주민들은 인근 대피소로 안전하게 대피했습니다."
     ],
     "tags": [
      "재난",
      "사회",
      "주거"
     ],
     "importance": 8,
     "sources": [
      {
       "name": "매일경제",
       "url": "https://www.mk.co.kr/news/society/12187537"
      },
      {
       "name": "연합뉴스",
       "url": "https://www.yna.co.kr/view/AKR20261027181600004"
      },
      {
       "name": "조선일보",
       "url": "https://www.chosun.com/national/national_general/2026/10/28/AVPFFUKKHBC63HLGWOQHQHYFH4/"
      },
      {
       "name": "MBC 뉴스",
       "url": "https://news.google.com/rss/articles/CBMid0FVX3lxTE5mT1BIN2VDY1VPSHI1ZDBFQ0p1UEdWbU5zOVhwOVZvYldwSkdLS3JyUFNPSTlhbWo4anV2emNYQXZnZ1BWSVR2cl9qSnlYdzBPUDJQRXpOZTdvcVhIM3dVZFB2MkY5RUJGUC1fVVJfUFRUR0YxUW5r0gF3QVVfeXFMT3lZQ2huQ056Ukx6TjYxRXlmT2M3ak1XQ1pCb2xxQnZ1ZDRnYmZfYzhpUUl0MVJQekFrUmNrbk0yWkJmUnZ2R29aWkpMcnJZclY2Q3NUTk5nQkVDM1VmN3Z6cE94UE5qb1AyWDAtdlFBMVZrcmZ4aTA?oc=5"
      }
     ],
     "original_title": "‘강남 마지막 판자촌’ 구룡마을 화재 확산 중…“용수 부족해 진압 어려움”",
     "published_at": "2026-10-27T17:38+00:00",
     "qa": [
      {
       "q": "구룡마을 화재는 어디서 시작되어 어떻게 확산되었나요?",
       "a": "2지구의 한 가건물에서 시작되어 강한 바람을 타고 인근 1지구와 3지구 등 남쪽 방향으로 빠르게 번졌어요."
      },
      {
       "q": "진화 작업이 어려웠던 이유는 무엇인가요?",
       "a": "불에 타기 쉬운 자재로 지어진 판잣집이 밀집해 있고 소방차 진입이 어려운 구조적 취약성 때문이에요."
      },
      {
       "q": "이번 화재로 인한 피해 규모는 얼마나 되나요?",
       "a": "1·2·3지구에서 77가구 107명이 피해를 보았으며 주민들은 대피소로 대피했어요."
      }
     ]
    },
    {
     "id": "3b2e8c8409b8",
     "title_ko": "압수수색 받은 아주대병원 소아응급 교수 7명 사직 의사",
     "summary_ko": [
      "환아 사망 사고로 경찰의 압수수색을 받은 아주대병원 소아전문응급의료센터 교수 7명이 사직 의사를 밝혔습니다.",
      "국정감사에서 경찰 수사 책임자가 사과 대신 안타깝다는 입장을 반복하자 의료진이 반발했습니다.",
      "복지부는 경찰청과 협의를 더 하겠다고 밝혔으나 의료 공백 우려가 커지고 있습니다."
     ],
     "tags": [
      "의료",
      "사회"
     ],
     "importance": 8,
     "sources": [
      {
       "name": "연합뉴스",
       "url": "https://www.yna.co.kr/view/AKR20261027166051530"
      }
     ],
     "original_title": "압색 받은 소아응급 교수 7명 사직 의사…정은경 \"경찰과 협의\"(종합)",
     "published_at": "2026-10-27T14:31+00:00",
     "qa": [
      {
       "q": "아주대병원 소아응급 교수들이 사직 의사를 밝힌 이유는 무엇인가요?",
       "a": "환아 사망 사고로 경찰의 압수수색을 받은 뒤 국정감사에서 수사 책임자가 사과 대신 안타깝다는 입장을 반복했기 때문입니다."
      },
      {
       "q": "경찰의 압수수색은 언제 이루어졌나요?",
       "a": "환아 사망 후 약 두 달 만인 지난달 30일에 경기남부경찰청이 압수수색을 실시했습니다."
      },
      {
       "q": "보건복지부 장관은 이에 대해 어떤 대응을 약속했나요?",
       "a": "정은경 보건복지부 장관은 경찰청과 협의를 좀 더 하겠다고 답했습니다."
      }
     ]
    },
    {
     "id": "bce0beeb5dd2",
     "title_ko": "선관위 특검, 투표지 247만장 검증 착수",
     "summary_ko": [
      "선관위 특검팀이 투표지 247만장에 대한 본격적인 검증 작업에 돌입했습니다.",
      "관련 수사가 진행 중인 가운데 철저한 증거 확인이 이루어질 예정입니다.",
      "이번 검증 결과가 향후 관련 의혹 규명에 큰 영향을 미칠 전망입니다."
     ],
     "tags": [
      "정치",
      "사회"
     ],
     "importance": 7,
     "sources": [
      {
       "name": "조선일보",
       "url": "https://www.chosun.com/national/court_law/2026/10/28/CTB2YCTNWJEK3A2V67Z7PXKWAA/"
      }
     ],
     "original_title": "선관위 특검, 오늘 투표지 247만장 검증",
     "published_at": "2026-10-27T15:46+00:00"
    },
    {
     "id": "f517fb36053f",
     "title_ko": "복지부 장관 \"10대 마약 치료 인프라 확충 추진할 것\"",
     "summary_ko": [
      "정은경 보건복지부 장관이 10대 마약 중독자 증가에도 청소년 전담 치료 병상이 부족하다는 지적에 공감했습니다.",
      "전국 치료기관 32곳 중 다수가 실적이 없고 의료진 보호와 인력 부족 문제가 지적되었습니다.",
      "정부는 학회와 협의해 수가 신설 및 치료 인프라 확충 계획을 추진할 방침입니다."
     ],
     "tags": [
      "의료",
      "사회"
     ],
     "importance": 7,
     "sources": [
      {
       "name": "연합뉴스",
       "url": "https://www.yna.co.kr/view/AKR20261027191900004"
      }
     ],
     "original_title": "복지장관, 10대 마약 병상 부족 문제에 \"치료 인프라 확충 추진\"",
     "published_at": "2026-10-27T14:54+00:00"
    }
   ]
  },
  "kr_economy": {
   "label": "경제",
   "briefing": "경제 분야에서는 가상자산 과세 유예 논의와 불법사금융 처벌 강화, 소상공인 대출 연체율 및 고용 한파가 주요 이슈였습니다.",
   "items": [
    {
     "id": "132ae34e179d",
     "title_ko": "민주당, 오늘 당정 협의서 가상자산 과세 유예 논의",
     "summary_ko": [
      "더불어민주당이 당정 협의를 열고 가상자산 과세 유예 방안을 본격적으로 논의합니다.",
      "시장 상황과 투자자 보호 필요성이 대두되면서 과세 시기 조정에 관심이 쏠리고 있습니다.",
      "이번 논의 결과에 따라 향후 디지털자산 시장의 과세 정책 방향이 결정될 전망입니다."
     ],
     "tags": [
      "경제"
     ],
     "importance": 8,
     "sources": [
      {
       "name": "KBS 뉴스",
       "url": "https://news.google.com/rss/articles/CBMiW0FVX3lxTE1PZy1MMXVoS0plU2JVZEtCZ3RqTVBnNElCZzd3T1FDcm9ScGFPaUhaSjNDRVR4LTNDR1FoU2FheDFjc0swWlhGcGcyUV9OSzdUNndQZFlhekw2clU?oc=5"
      }
     ],
     "original_title": "민주당, 오늘 당정 협의서 가상자산 과세 ‘유예’ 논의",
     "published_at": "2026-10-27T16:02+00:00",
     "qa": [
      {
       "q": "민주당은 어떤 회의에서 가상자산 과세를 논의하나요?",
       "a": "당정 협의를 열고 가상자산 과세 유예 방안을 본격적으로 논의합니다."
      },
      {
       "q": "과세 유예가 논의되는 배경은 무엇인가요?",
       "a": "시장 상황과 투자자 보호 필요성이 대두되면서 과세 시기 조정에 관심이 쏠리고 있습니다."
      },
      {
       "q": "향후 어떤 결정이 내려질 전망인가요?",
       "a": "이번 논의 결과에 따라 향후 디지털자산 시장의 과세 정책 방향이 결정될 전망입니다."
      }
     ]
    },
    {
     "id": "52ddc3658835",
     "title_ko": "구룡마을 또 대형 화재…이재민 주거 대책과 재개발 영향 주목",
     "summary_ko": [
      "강남구 구룡마을에서 발생한 대형 화재로 100명이 넘는 주민이 거처를 잃었습니다.",
      "SH는 지난 1월 화재 때와 비슷한 임시주택 지원 등 이주 대책을 검토하고 있습니다.",
      "이번 화재가 내년 이주 완료와 하반기 착공을 목표로 한 재개발 사업에 미칠 영향이 주목됩니다."
     ],
     "tags": [
      "부동산",
      "주거",
      "경제"
     ],
     "importance": 8,
     "sources": [
      {
       "name": "연합뉴스",
       "url": "https://www.yna.co.kr/view/AKR20261027186900004"
      }
     ],
     "original_title": "재개발 앞둔 구룡마을 또 큰불…집 잃은 주민들 어디로 가나",
     "published_at": "2026-10-27T12:59+00:00",
     "qa": [
      {
       "q": "구룡마을 화재 이주민들을 위해 어떤 지원이 검토되나요?",
       "a": "서울주택도시개발공사(SH)는 올해 1월 대형 화재 때와 비슷한 수준의 임시주택 지원 등 이주 대책을 검토하고 있습니다."
      },
      {
       "q": "구룡마을 재개발 사업은 현재 어떤 단계인가요?",
       "a": "통합심마를 마치고 내년 이주 완료와 하반기 착공을 목표로 주택 건설 단계로 접어들고 있습니다."
      },
      {
       "q": "재개발이 완료되면 어떤 주거단지가 조성되나요?",
       "a": "통합공공임대주택, 장기전세주택 미리내집, 공공·민간 분양주택 등 총 3천739세대 규모의 단지가 들어섭니다."
      }
     ]
    },
    {
     "id": "702baea17610",
     "title_ko": "금융위, 연 60% 초과 불법사금융 처벌 '징역 10년'으로 강화",
     "summary_ko": [
      "금융위원회가 연 60%를 초과하는 초고금리 불법사금융 업자에 대한 형사처벌을 대폭 강화합니다.",
      "법무부와 협의를 마치고 최대 징역 10년 또는 벌금 5억원으로 상향하는 법 개정을 추진합니다.",
      "민사상 원금·이자 무효화에 이어 형사 처벌도 강화해 서민 금융 안정에 기여할 것으로 기대됩니다."
     ],
     "tags": [
      "경제"
     ],
     "importance": 8,
     "sources": [
      {
       "name": "연합뉴스",
       "url": "https://www.yna.co.kr/view/AKR20261027178700002"
      }
     ],
     "original_title": "금융위, 초고금리 불법사금융 '징역 10년·벌금 5억'으로 강화",
     "published_at": "2026-10-27T10:13+00:00",
     "qa": [
      {
       "q": "불법사금융 처벌은 어떻게 강화되나요?",
       "a": "연 60%를 초과하는 초고금리 대부업자에 대한 형사처벌을 최대 징역 10년 또는 벌금 5억원으로 상향합니다."
      },
      {
       "q": "어떤 기관들과 협의하여 추진되나요?",
       "a": "법무부와 협의를 마치고 조만간 정기국회에 입법 발의할 계획입니다."
      },
      {
       "q": "취약계층을 위한 금융 지원 대책에는 무엇이 있나요?",
       "a": "연 4.5% 금리로 100만원을 10년간 빌려주는 소액 장기대출 상품을 내년 예산안에 담았습니다."
      }
     ]
    },
    {
     "id": "d14bc2819741",
     "title_ko": "골목상권 시름 깊어져…소상공인 대출 연체율 13년 만에 최고",
     "summary_ko": [
      "경기 침체 장기화로 골목상권 소상공인들의 대출 연체율이 13년 만에 최고치를 기록했습니다.",
      "원자재 가격 상승과 소비 부진이 겹치면서 자영업자의 상환 능력이 급격히 떨어졌습니다.",
      "취약 차주를 위한 금융 지원과 실효성 있는 대책 마련이 시급하다는 지적입니다."
     ],
     "tags": [
      "경제",
      "고용"
     ],
     "importance": 7,
     "sources": [
      {
       "name": "조선일보",
       "url": "https://www.chosun.com/economy/economy_general/2026/10/28/73G3QTXVPRBZRH7WQBY43I5DXU/"
      }
     ],
     "original_title": "골목 사장님들의 비명… 대출 연체율 13년만에 최고",
     "published_at": "2026-10-27T15:51+00:00"
    },
    {
     "id": "f31f6eb4be72",
     "title_ko": "반도체도 못 살린 고용…청년·60대 취업시장 동반 침체",
     "summary_ko": [
      "반도체 등 주력 산업의 수출 회복에도 불구하고 고용 시장의 온기가 전체로 퍼지지 못하고 있습니다.",
      "청년층과 60대 이상 고령층의 취업시장이 동시에 얼어붙으면서 고용 지표에 경고등이 켜졌습니다.",
      "경기 불확실성에 대응하기 위한 맞춤형 일자리 대책과 고용 구조 개선이 요구됩니다."
     ],
     "tags": [
      "고용",
      "경제"
     ],
     "importance": 7,
     "sources": [
      {
       "name": "조선일보",
       "url": "https://www.chosun.com/economy/economy_general/2026/10/28/4UEYAZMPQRFJNHJB4NNAE3H64Q/"
      }
     ],
     "original_title": "반도체도 못 늘린 고용… 청년·60대 취업시장 동시에 얼어붙었다",
     "published_at": "2026-10-27T15:51+00:00"
    }
   ]
  },
  "kr_entertainment": {
   "label": "연예",
   "briefing": "연예 분야에서는 헤이지니의 노동착취 논란 해명, 실업급여 해외여행 비판, 그리고 만화 거장의 별세 소식이 전해졌습니다.",
   "items": [
    {